{
  "schema_version": 1,
  "country": "TR",
  "scope": "official-listing-only",
  "notes": [
    "A record proves only that an official provider page listed the device when reviewed.",
    "A listing does not establish an exact ISP firmware, credentials, privileged access, root shell, bootloader access, or interchangeability.",
    "No configuration backups, firmware images, credentials, serial numbers, MAC addresses, or subscriber identifiers are stored here."
  ],
  "sources": [
    {
      "id": "turk-telekom-modem-wifi",
      "provider_id": "turk-telekom",
      "title": "Türk Telekom Modem ve Wi-Fi",
      "url": "https://bireysel.turktelekom.com.tr/cihazlar/modem-ve-internet",
      "expected_device_count": 12,
      "last_reviewed": "2026-08-13"
    },
    {
      "id": "turk-telekom-hc220-g5",
      "provider_id": "turk-telekom",
      "title": "Türk Telekom TP-Link HC220-G5 Mesh WiFi product page",
      "url": "https://bireysel.turktelekom.com.tr/cihazlar/modem-ve-internet/tp-link-hc220-g5-mesh-wifi",
      "expected_device_count": 1,
      "last_reviewed": "2026-08-13"
    },
    {
      "id": "turk-telekom-mc12",
      "provider_id": "turk-telekom",
      "title": "Türk Telekom TP-Link MC12 Mesh WiFi product page",
      "url": "https://bireysel.turktelekom.com.tr/cihazlar/modem-ve-internet/tp-link-mc12-mesh-wifi",
      "expected_device_count": 1,
      "last_reviewed": "2026-08-13"
    },
    {
      "id": "turk-telekom-h196a",
      "provider_id": "turk-telekom",
      "title": "Türk Telekom ZTE ZXHN H196A Mesh WiFi product page",
      "url": "https://bireysel.turktelekom.com.tr/cihazlar/modem-ve-internet/zte-zxhn-h196a-mesh-wifi",
      "expected_device_count": 1,
      "last_reviewed": "2026-08-13"
    },
    {
      "id": "turk-telekom-tcl-mw42v",
      "provider_id": "turk-telekom",
      "title": "Türk Telekom TCL MW42V Mobil Modem product page",
      "url": "https://bireysel.turktelekom.com.tr/cihazlar/modem-ve-internet/tcl-mw42v-mobil-modem",
      "expected_device_count": 1,
      "last_reviewed": "2026-08-13"
    },
    {
      "id": "superonline-modemler",
      "provider_id": "turkcell-superonline",
      "title": "Turkcell Superonline Modemler",
      "url": "https://www.superonline.net/kurumsal/yardim/modemler",
      "expected_device_count": 32,
      "last_reviewed": "2026-08-13"
    },
    {
      "id": "turksat-kablonet-devices",
      "provider_id": "turksat-kablonet",
      "title": "Türksat Kablonet Cihazlar",
      "url": "https://www.turksatkablonet.com/cihazlar",
      "expected_device_count": 5,
      "last_reviewed": "2026-08-13"
    },
    {
      "id": "turksat-kablo-devices",
      "provider_id": "turksat-kablonet",
      "title": "Türksat Kablo Cihazlar",
      "url": "https://www.turksatkablo.com.tr/yayin-akisi.aspx/inc/inc/userUpload/sayfa/formlar/Cihazlar",
      "expected_device_count": 11,
      "alternate_urls": [
        "https://www.turksatkablo.com.tr/Cihazlar"
      ],
      "last_reviewed": "2026-08-13"
    }
  ],
  "providers": [
    {
      "provider_id": "turk-telekom",
      "devices": [
        {
          "vendor": "D-Link",
          "model": "DVG X3030",
          "official_name": "D-link DVG X3030 Wİ-Fİ 6 İkili Mesh",
          "category": "mesh-wifi",
          "source_ids": ["turk-telekom-modem-wifi"]
        },
        {
          "vendor": "D-Link",
          "model": "DWR930M",
          "official_name": "DLINK DWR930M 4G/LTE MOBILE ROUTER BEYAZ",
          "category": "mobile-modem",
          "network_technology": "4G/LTE",
          "source_ids": ["turk-telekom-modem-wifi"]
        },
        {
          "vendor": "ZTE",
          "model": "ZXHN H1601-P",
          "official_name": "ZTE ZXHN H1601-P Wi-Fi 6 AX3000 Premium VDSL Modem",
          "category": "vdsl-modem",
          "network_technology": "VDSL",
          "source_ids": ["turk-telekom-modem-wifi"]
        },
        {
          "vendor": "Zyxel",
          "model": "DX3300",
          "official_name": "Zyxel DX3300 Wi-Fi 6 Premium VDSL Modem",
          "category": "vdsl-modem",
          "network_technology": "VDSL",
          "source_ids": ["turk-telekom-modem-wifi"]
        },
        {
          "vendor": "Huawei",
          "model": "DN8045X6-20",
          "official_name": "Huawei DN8045X6-20 Wi-Fi 6 Premium VDSL Modem",
          "category": "vdsl-modem",
          "network_technology": "VDSL",
          "source_ids": ["turk-telekom-modem-wifi"]
        },
        {
          "vendor": "TP-Link",
          "model": "TURBOBOX GO",
          "official_name": "TP-LINK TURBOBOX GO MOBİL MODEM",
          "category": "mobile-modem",
          "source_ids": ["turk-telekom-modem-wifi"]
        },
        {
          "vendor": "TP-Link",
          "model": "RE705X",
          "official_name": "TP-Link RE705X WiFİ 6 Repeater",
          "category": "signal-extender",
          "source_ids": ["turk-telekom-modem-wifi"]
        },
        {
          "vendor": "TP-Link",
          "model": "VX18",
          "official_name": "TP-Link VX18 Wi-Fi 6 VDSL Modem",
          "category": "vdsl-modem",
          "network_technology": "VDSL",
          "source_ids": ["turk-telekom-modem-wifi"]
        },
        {
          "vendor": "TP-Link",
          "model": "MX30",
          "official_name": "TP-Link MX30 Wi-Fi 6 AX3000 Mesh Wi-Fi",
          "category": "mesh-wifi",
          "source_ids": ["turk-telekom-modem-wifi"]
        },
        {
          "vendor": "TP-Link",
          "model": "HX520",
          "official_name": "TP-Link HX520 Wi-Fi 6 AX3000 Mesh Wi-Fi",
          "category": "mesh-wifi",
          "source_ids": ["turk-telekom-modem-wifi"]
        },
        {
          "vendor": "ZTE",
          "model": "H3601P",
          "official_name": "ZTE H3601P Wi-Fi 6 AX3000 Mesh WiFi",
          "category": "mesh-wifi",
          "source_ids": ["turk-telekom-modem-wifi"]
        },
        {
          "vendor": "TP-Link",
          "model": "MX18",
          "official_name": "TP-Link MX18 Wi-Fi 6 Mesh Wi-Fi",
          "category": "mesh-wifi",
          "source_ids": ["turk-telekom-modem-wifi"]
        },
        {
          "vendor": "TP-Link",
          "model": "HC220-G5",
          "official_name": "TP-Link HC220-G5 Mesh WiFi",
          "category": "mesh-wifi",
          "source_ids": ["turk-telekom-hc220-g5"]
        },
        {
          "vendor": "TP-Link",
          "model": "MC12",
          "official_name": "TP-Link MC12 Mesh WiFi",
          "category": "mesh-wifi",
          "source_ids": ["turk-telekom-mc12"]
        },
        {
          "vendor": "ZTE",
          "model": "ZXHN H196A",
          "official_name": "ZTE ZXHN H196A Mesh WiFi",
          "category": "mesh-wifi",
          "source_ids": ["turk-telekom-h196a"]
        },
        {
          "vendor": "TCL",
          "model": "MW42V",
          "official_name": "TCL MW42V Mobil Modem",
          "category": "mobile-modem",
          "source_ids": ["turk-telekom-tcl-mw42v"]
        }
      ]
    },
    {
      "provider_id": "turkcell-superonline",
      "devices": [
        {
          "vendor": "ZTE",
          "model": "MC8520B",
          "official_name": "ZTE MC8520B 5G",
          "category": "mobile-modem",
          "network_technology": "5G",
          "source_ids": ["superonline-modemler"]
        },
        {
          "vendor": "Huawei",
          "model": "HG552e",
          "official_name": "Huawei HG552e",
          "category": "not-specified",
          "source_ids": ["superonline-modemler"]
        },
        {
          "vendor": "AirTies",
          "model": "Air 6271",
          "official_name": "AirTies Air 6271",
          "category": "not-specified",
          "source_ids": ["superonline-modemler"]
        },
        {
          "vendor": "Huawei",
          "model": "HG552d",
          "official_name": "Huawei HG552d",
          "category": "not-specified",
          "source_ids": ["superonline-modemler"]
        },
        {
          "vendor": "ZTE",
          "model": "H168A",
          "official_name": "ZTE H168A",
          "category": "not-specified",
          "source_ids": ["superonline-modemler"]
        },
        {
          "vendor": "AirTies",
          "model": "Air 6372",
          "official_name": "AirTies Air 6372",
          "category": "not-specified",
          "source_ids": ["superonline-modemler"]
        },
        {
          "vendor": "Zyxel",
          "model": "EX3501",
          "official_name": "ZYXEL EX3501",
          "category": "not-specified",
          "source_ids": ["superonline-modemler"]
        },
        {
          "vendor": "Huawei",
          "model": "HG253/S",
          "official_name": "Huawei HG253/S",
          "category": "not-specified",
          "source_ids": ["superonline-modemler"]
        },
        {
          "vendor": "Nokia",
          "model": "G-2426G-A",
          "official_name": "Nokia G-2426G-A",
          "category": "not-specified",
          "source_ids": ["superonline-modemler"]
        },
        {
          "vendor": "ZTE",
          "model": "H3600",
          "official_name": "ZTE H3600",
          "category": "not-specified",
          "source_ids": ["superonline-modemler"]
        },
        {
          "vendor": "TP-Link",
          "model": "EX530v",
          "official_name": "TP-LINK EX530v",
          "category": "not-specified",
          "source_ids": ["superonline-modemler"]
        },
        {
          "vendor": "ZTE",
          "model": "H3600P",
          "official_name": "ZTE H3600P",
          "category": "not-specified",
          "source_ids": ["superonline-modemler"]
        },
        {
          "vendor": "TP-Link",
          "model": "EB810v",
          "official_name": "TP Link EB810v",
          "category": "not-specified",
          "source_ids": ["superonline-modemler"]
        },
        {
          "vendor": "Huawei",
          "model": "H162-383",